genres,budget,popularity,production_companies,production_countries,release_date,revenue,runtime,vote_average,vote_count,overview
Drama,30000000,27.448,"Lakeshore Entertainment, Malpaso Productions, Epsilon Motion Pictures, ASR Productions, Warner Bros. Pictures","Switzerland, United States of America",2004,216763646,132,7.956,9487,"Despondent over a painful estrangement from his daughter, trainer Frankie Dunn isn't prepared for boxer Maggie Fitzgerald to enter his life. But Maggie's determined to go pro and to convince Dunn and his cohort to help her."
"Drama, Romance",15000000,57.337,"Celador Films, Film4 Productions",United Kingdom,2008,378400000,120,7.7,10493,"A teenager reflects on his life after being accused of cheating on the Indian version of ""Who Wants to be a Millionaire?""."
"Drama, History, War",17500000,20.493,"Lionsgate, United Artists, The Department of Trade, Industry and Competition of South Africa, Miracle Pictures, Seamus, Inside Track, Kiagli Releasing, Mikado Film, Metro-Goldwyn-Mayer","Italy, South Africa, United Kingdom, United States of America",2004,38000000,121,7.7,2824,"Inspired by true events, this film takes place in Rwanda in the 1990s when more than a million Tutsis were killed in a genocide that went mostly unnoticed by the rest of the world. Hotel owner Paul Rusesabagina houses over a thousand refuges in his hotel in attempt to save their lives."
"Drama, Romance",2000000,21.164,"Rossen Films, 20th Century Fox",United States of America,1961,7600000,134,7.676,957,Fast Eddie Felson is a small-time pool hustler with a lot of talent but a self-destructive attitude. His bravado causes him to challenge the legendary Minnesota Fats to a high-stakes match.
"Comedy, Drama, Romance",55000000,127.113,"Paramount Pictures, The Steve Tisch Company, Wendy Finerman Productions",United States of America,1994,677387716,142,8.471,27383,"A man with a low IQ has accomplished great things in his life and been present during significant historic events—in each case, far exceeding what anyone imagined he could do. But despite all he has achieved, his one true love eludes him."
"Thriller, Crime",8500000,98.161,"Miramax, A Band Apart, Jersey Films",United States of America,1994,213928762,154,8.5,27853,"A burger-loving hit man, his philosophical partner, a drug-addled gangster's moll and a washed-up boxer converge in this sprawling, comedic crime caper. Their adventures unfurl in three stories that ingeniously trip back and forth in time."
"Mystery, Crime, Thriller",250000,14.332,Warner Bros. Pictures,United States of America,1946,10682000,114,7.6,1026,"Private Investigator Philip Marlowe is hired by wealthy General Sternwood regarding a matter involving his youngest daughter Carmen. Before the complex case is over, Marlowe sees murder, blackmail, deception, and what might be love."
"Action, Thriller, Science Fiction",102000000,72.85,"Carolco Pictures, Pacific Western, Lightstorm Entertainment, Le Studio Canal+","France, United States of America",1991,520000000,137,8.1,12807,"Set ten years after the events of the original, James Cameron’s classic sci-fi action flick tells the story of a second attempt to get the rid of rebellion leader John Connor, this time targeting the boy himself. However, the rebellion has sent a reprogrammed terminator to protect Connor."
Drama,2000000,21.034,"Pakula-Mulligan, Brentwood Productions",United States of America,1962,13129846,129,8.001,2580,"Scout Finch, 6, and her older brother Jem live in sleepy Maycomb, Alabama, spending much of their time with their friend Dill and spying on their reclusive and mysterious neighbor, Boo Radley. When Atticus, their widowed father and a respected lawyer, defends a black man named Tom Robinson against fabricated rape charges, the trial and tangent events expose the children to evils of racism and stereotyping."
"Crime, Thriller",320000,26.015,"United Artists, Harris-Kubrick Productions",United States of America,1956,0,85,7.653,1516,"Career criminal Johnny Clay recruits a sharpshooter, a crooked police officer, a bartender and a betting teller named George, among others, for one last job before he goes straight and gets married. But when George tells his restless wife about the scheme to steal millions from the racetrack where he works, she hatches a plot of her own."
"Thriller, Mystery",1000000,25.112,"Paramount Pictures, Patron Inc.",United States of America,1954,37042336,112,8.351,6453,A wheelchair-bound photographer spies on his neighbors from his apartment window and becomes convinced one of them has committed murder.
"Science Fiction, Drama, Romance",20000000,83.926,"Focus Features, Anonymous Content, This is that",United States of America,2004,72258126,108,8.099,14864,"Joel Barish, heartbroken that his girlfriend underwent a procedure to erase him from her memory, decides to do the same. However, as he watches his memories of her fade away, he realises that he still loves her, and may be too late to correct his mistake."
"Drama, Thriller",1800000,20.97,"Charles K. Feldman Group, Warner Bros. Pictures",United States of America,1951,8000000,125,7.6,1339,A fading southern belle moves in with her sister in New Orleans where her ferocious brother-in-law takes stabs at her sanity.
"Animation, Comedy, Family, Fantasy",150000000,116.791,"Pixar, Walt Disney Pictures",United States of America,2007,623726000,111,7.8,16961,"Remy, a resident of Paris, appreciates good food and has quite a sophisticated palate. He would love to become a chef so he can create and enjoy culinary masterpieces to his heart's delight. The only problem is, Remy is a rat. When he winds up in the sewer beneath one of Paris' finest restaurants, the rodent gourmet finds himself ideally placed to realize his dream."
Drama,3800000,31.878,"Zentropa International Sweden, Zentropa Entertainments, Film i Väst","Denmark, Sweden",2012,18300000,116,8.1,4152,"A teacher lives a lonely life, all the while struggling over his son’s custody. His life slowly gets better as he finds love and receives good news from his son, but his new luck is about to be brutally shattered by an innocent little lie."
"Drama, War, Mystery",6800000,27.958,"TS Productions, Phi Group, micro_scope","Canada, France",2010,6788659,131,8.1,2712,"A mother's last wishes send twins Jeanne and Simon on a journey to Middle East in search of their tangled roots. Adapted from Wajdi Mouawad's acclaimed play, Incendies tells the powerful and moving tale of two young adults' voyage to the core of deep-rooted hatred, never-ending wars and enduring love."
"Drama, Action, Thriller, Crime, Mystery",125000,28.299,"Media Asia Films, Basic Pictures",Hong Kong,2002,8708932,100,7.819,1618,"Chan Wing Yan, a young police officer, has been sent undercover as a mole in the local mafia. Lau Kin Ming, a young mafia member, infiltrates the police force. Years later, their older counterparts, Chen Wing Yan and Inspector Lau Kin Ming, respectively, race against time to expose the mole within their midst."
"Mystery, Thriller",9000000,45.193,"Newmarket Films, Summit Entertainment, Team Todd, I Remember Productions",United States of America,2000,40047236,113,8.2,14787,"Leonard Shelby is tracking down the man who raped and murdered his wife. The difficulty of locating his wife's killer, however, is compounded by the fact that he suffers from a rare, untreatable form of short-term memory loss. Although he can recall details of life before his accident, Leonard cannot remember what happened fifteen minutes ago, where he's going, or why."
"Drama, Romance",58000000,36.652,"Universal Pictures, DreamWorks Pictures, Imagine Entertainment",United States of America,2001,316800000,135,7.858,10126,"Brilliant mathematician, John Nash, is on the brink of international acclaim when he becomes entangled in a mysterious conspiracy."
